title,content,label,source,publish_date
"Economic Growth Shows Positive Trends","The latest economic indicators show steady growth in key sectors. GDP increased by 2.1% this quarter, driven by consumer spending and business investment. Manufacturing output rose by 1.8%, while unemployment dropped to 3.9%. Financial experts note that these trends suggest a stable economic environment for the coming months.",1,reuters.com,2024-01-15
"SHOCKING: Government Hiding Secret Alien Base!!!","You won't BELIEVE what we discovered! SECRET government documents PROVE aliens are living among us!!! They're hiding in underground bases and controlling our minds! SHARE this before it gets DELETED! The truth is out there and THEY don't want you to know!!!",0,conspiracytruth.net,2024-01-10
"Climate Change Research Reveals New Findings","Recent studies from leading climate scientists indicate significant changes in global temperature patterns. The research, published in Nature Climate Change, shows accelerated warming in polar regions. Dr. Sarah Johnson from MIT explained that these findings provide crucial data for understanding future climate impacts.",1,nature.com,2024-01-20
"Miracle Cure EXPOSED: Doctors Hate This One Trick!","BREAKING: Local woman discovers ONE WEIRD TRICK that DESTROYS diabetes! Big Pharma is FURIOUS! Click here to learn the SECRET that doctors don't want you to know! This AMAZING discovery will change your life FOREVER! Limited time offer - act NOW!",0,healthsecrets.biz,2024-01-12
"Technology Sector Sees Investment Surge","Investment in technology companies reached record highs this quarter, with venture capital funding totaling $45 billion. Artificial intelligence and clean energy technologies attracted the most investment. Industry analysts predict continued growth as companies adapt to digital transformation needs.",1,techcrunch.com,2024-01-18
"URGENT: Vaccines Contain Mind Control Chips!","EXPOSED: Secret government plan to control population through vaccination! Microchips in vaccines are tracking your every move! Don't let them inject you with POISON! Wake up sheeple! RESIST the NEW WORLD ORDER! Share this truth before it's too late!",0,truthseeker.info,2024-01-08
"Educational Funding Increases in Public Schools","State governments announced increased funding for public education, with a focus on STEM programs and teacher training. The $2.3 billion initiative aims to improve educational outcomes and reduce class sizes. Education Secretary Maria Rodriguez emphasized the importance of investing in future generations.",1,education.gov,2024-01-22
"Celebrity Scandal Rocks Hollywood! You Won't Believe What Happened!","SHOCKING celebrity news that will leave you speechless! Famous actor caught in compromising situation! Photos leaked! Career DESTROYED! Click to see the EXCLUSIVE images that everyone is talking about! This scandal will change Hollywood FOREVER!",0,celebritygossip.buzz,2024-01-14
"Healthcare Innovation Improves Patient Outcomes","New medical technology is revolutionizing patient care across major hospitals. The innovative system reduces treatment time by 40% while improving accuracy. Dr. Michael Chen, chief of surgery at General Hospital, reported significant improvements in patient recovery rates.",1,medicalnews.com,2024-01-25
"BREAKING: Pizza Restaurant Running Child Trafficking Ring!","EXPLOSIVE investigation reveals SHOCKING truth about local pizza place! Underground tunnels discovered! Children rescued! Police cover-up exposed! Mainstream media WON'T report this! Citizens must take action! Boycott NOW! Save our children from these MONSTERS!",0,patriotfreedom.org,2024-01-11